{
  "id": "prayer-gratitude-protection",
  "title": "Prayer of Gratitude for God's Protection",
  "content": "Heavenly Father,\n\nLike Noah and his family, we thank You for Your loving protection. You watched over them in the ark during the great storm, and You watch over us every day.\n\nThank You for keeping us safe from harm. Thank You for providing for our needs, just as You provided food and shelter for Noah's family and all the animals.\n\nHelp us to trust in Your protection when we face difficult times. Remind us that You are always with us, just as You were with Noah.\n\nWe praise You for Your constant care and love.\n\nIn Jesus' name, Amen.",
  "category": "thanksgiving",
  "ageRating": "all",
  "bibleReference": {
    "book": "Genesis",
    "chapter": 7,
    "verses": "16",
    "translation": "KJV"
  },
  "tags": ["protection", "gratitude", "Noah", "ark", "trust"],
  "isTemplate": true,
  "createdAt": "2025-08-25T21:22:47Z",
  "updatedAt": "2025-08-25T21:22:47Z"
}